id,source,title,company,location,country,salary_min,salary_max,currency,skills,skills_count,contract_type,description_excerpt,posted_date,url,collected_at
5275285732,adzuna,Business Developer (m/w/d) – Plant Engineering,Wölfel Group,"Höchberg, Würzburg (Kreis)",DE,,,EUR,DevOps,1,,Innovation - Tradition - Wir-Gefühl Das ist die Welt von Wölfel. Sie möchten Ihre Begeisterung für moderne IT-Infrastrukturen in einem internationalen Umfeld einbringen und sind offen für spannende Pr...,2025-06-30,https://www.adzuna.de/details/5275285732?utm_medium=api&utm_source=44534cc0,2025-06-30T15:40:38.456392
5275285335,adzuna,Managing Consultant (m/w/d) ServiceNow,GLASER LEMKE Managementberatung GmbH,"Dortmund, Nordrhein-Westfalen",DE,,,EUR,,0,,"Einleitung Unser Klient ist eine innovative und international aufgestellte IT-Prozessberatung, die technologische Kompetenz mit ausgeprägtem fachlichen und betriebswirtschaftlichen Know-how verbindet....",2025-06-30,https://www.adzuna.de/details/5275285335?utm_medium=api&utm_source=44534cc0,2025-06-30T15:40:38.456392
5275285291,adzuna,React Developer:in (m/w/d) im Kölner Startup,GreenPocket GmbH,"Köln, Nordrhein-Westfalen",DE,,,EUR,"React, Machine Learning, AI, Agile",4,,DAS SIND WIR Als agiles Startup im dynamischen Wachstumsmarkt für Smart-Energy-Software begleiten wir weltweit Energieversorger und Unternehmenskunden bei der Realisierung von Mehrwerten aus Smart-Met...,2025-06-30,https://www.adzuna.de/details/5275285291?utm_medium=api&utm_source=44534cc0,2025-06-30T15:40:38.456392
5275284975,adzuna,Internship/Thesis – Sensor Technology/IIoT for Wind Turbines (m/f/d),Wölfel Group,"Leipzig (Kreis), Sachsen",DE,,,EUR,,0,contract,"INNOVATION - TRADITION - WE-FEELING This is the world of Wölfel. If you have a passion for renewable energies and like to develop innovative solutions, then we would be delighted if you become part of...",2025-06-30,https://www.adzuna.de/details/5275284975?utm_medium=api&utm_source=44534cc0,2025-06-30T15:40:38.456392
5275284808,adzuna,Full Stack Java / Kotlin-Entwickler:in (m/w/d) im Kölner Startup,GreenPocket GmbH,"Köln, Nordrhein-Westfalen",DE,,,EUR,"Java, Agile",2,,"GREEN POCKET Als agiles, grünes Startup und Spezialist für Energiemanagement- und Visualisierungssoftware beteiligen wir uns aktiv an der Gestaltung einer nachhaltigen, klimaneutralen Zukunft. So ist ...",2025-06-30,https://www.adzuna.de/details/5275284808?utm_medium=api&utm_source=44534cc0,2025-06-30T15:40:38.456392
5275284547,adzuna,Senior Test Development Engineer (m/f/x),Finisar Germany GmbH,"Berlin, Deutschland",DE,,,EUR,AI,1,,"Company Profile Coherent empowers market innovators to define the future through breakthrough technologies, from materials to systems. We deliver innovations that resonate with our customers in a wide...",2025-06-30,https://www.adzuna.de/details/5275284547?utm_medium=api&utm_source=44534cc0,2025-06-30T15:40:38.456392
5275283754,adzuna,Software Developer for customer projects (m/f/d),ModuleWorks GmbH,"Aachen (Kreis), Nordrhein-Westfalen",DE,,,EUR,,0,,"We are hiring At ModuleWorks we develop software components for the CAD/CAM industry, which are used to control and simulate CNC machines and robots. With over 200 employees and more than 70% of the w...",2025-06-30,https://www.adzuna.de/details/5275283754?utm_medium=api&utm_source=44534cc0,2025-06-30T15:40:38.456392
5275283747,adzuna,Business Developer (m/w/d) für MVP-Entwicklungen,Star Finanz GmbH,"Hamburg, Deutschland",DE,,,EUR,,0,,Star Finanz-Software Entwicklung und Vertriebs GmbH Star Finanz ist führender Anbieter für multibankenfähiges Online- und Mobile-Banking: Die App Sparkasse zählt zu den führenden Mobile-Banking-Anwend...,2025-06-30,https://www.adzuna.de/details/5275283747?utm_medium=api&utm_source=44534cc0,2025-06-30T15:40:38.456392
5275283596,adzuna,Java Frontend Entwickler (m/w/d) - Elektronisches Postfach,Finanz Informatik GmbH & Co. KG,"Münster, Nordrhein-Westfalen",DE,,,EUR,Java,1,,Als einer der größten Banken-IT-Dienstleister und Digitalisierungspartner Europas sind wir der Treiber der Digitalisierung innerhalb der Sparkassen-Finanzgruppe. Mit über 5.000 Mitarbeiter:innen an 3 ...,2025-06-30,https://www.adzuna.de/details/5275283596?utm_medium=api&utm_source=44534cc0,2025-06-30T15:40:38.456392
5275283320,adzuna,Senior PHP-Developer (m/w/d),Webfader GmbH,"Hamburg, Deutschland",DE,,,EUR,"PHP, AI",2,,"Our Mission: Web-based project solutions & tailor-made software Wir sind Webfader systems & solutions, Softwareentwickler:innen und Lösungsfinder:innen für die Digitalisierung des Alltags Wir streben ...",2025-06-30,https://www.adzuna.de/details/5275283320?utm_medium=api&utm_source=44534cc0,2025-06-30T15:40:38.457390
5275283092,adzuna,Engineer / Developer EDI Integration (m/w/d),Duvenbeck Unternehmensgruppe,Deutschland,DE,,,EUR,,0,,"Einleitung Wir bei Duvenbeck begeistern mit unserer „Kultur der Logistik“ zahlreiche Unternehmen der Automobil-, Kunststoff- und landwirtschaftlichen Fahrzeugindustrie. Mit über 6.500 Mitarbeitenden a...",2025-06-30,https://www.adzuna.de/details/5275283092?utm_medium=api&utm_source=44534cc0,2025-06-30T15:40:38.457390
5275283031,adzuna,Senior Salesforce Developer (m/w/d),Galileo Global Education Germany GmbH,"München, München (Kreis)",DE,,,EUR,,0,,Einleitung In einer dynamischen Welt ist der Stellenwert von Bildung im Hinblick auf Zukunftsvisionen und -sicherheit kaum zu benennen. Sowohl im privaten als auch im beruflichen Umfeld eröffnen sich ...,2025-06-30,https://www.adzuna.de/details/5275283031?utm_medium=api&utm_source=44534cc0,2025-06-30T15:40:38.457390
5275265446,adzuna,"Consultant, Strategy & Transformation (Fluent in German)",Mastercard,"Altstadt, Frankfurt am Main",DE,,,EUR,"Go, AI",2,,"Our Purpose Mastercard powers economies and empowers people in 200 countries and territories worldwide. Together with our customers, we’re helping build a sustainable economy where everyone can prospe...",2025-06-30,https://www.adzuna.de/details/5275265446?utm_medium=api&utm_source=44534cc0,2025-06-30T15:40:38.457390
5275263789,adzuna,"Systems Navigator (SN) - Kaiserslautern, Germany",Patriot Enterprises LLC,Deutschland,DE,,,EUR,AI,1,,"The EFMP is a mandatory enrollment program that works with other military and civilian agencies to provide comprehensive and coordinated community support, housing, educational, medical, and personnel...",2025-06-30,https://www.adzuna.de/details/5275263789?utm_medium=api&utm_source=44534cc0,2025-06-30T15:40:38.457390
5275263542,adzuna,"Work Student, Solutions Engineering (all genders)",TeamViewer GmbH,"Faurndau, Göppingen",DE,,,EUR,,0,,"Join TeamViewer, the leader in remote connectivity software. We harness the potential of cutting-edge technologies such as Augmented Reality and Artificial Intelligence to push the boundaries of innov...",2025-06-30,https://www.adzuna.de/details/5275263542?utm_medium=api&utm_source=44534cc0,2025-06-30T15:40:38.457390
5275263552,adzuna,"Intern, UX Design and Research (all genders)",TeamViewer GmbH,"Vaihingen, Stuttgart",DE,,,EUR,,0,,"Join TeamViewer, the leader in remote connectivity software. We harness the potential of cutting-edge technologies such as Augmented Reality and Artificial Intelligence to push the boundaries of innov...",2025-06-30,https://www.adzuna.de/details/5275263552?utm_medium=api&utm_source=44534cc0,2025-06-30T15:40:38.457390
5275263534,adzuna,Senior IT Workplace System Engineer (all genders),TeamViewer GmbH,"Faurndau, Göppingen",DE,,,EUR,,0,,"Join TeamViewer, the leader in remote connectivity software. We harness the potential of cutting-edge technologies such as Augmented Reality and Artificial Intelligence to push the boundaries of innov...",2025-06-30,https://www.adzuna.de/details/5275263534?utm_medium=api&utm_source=44534cc0,2025-06-30T15:40:38.457390
5275263544,adzuna,"Vice President, Software Development - TeamViewer Frontline (all genders)",TeamViewer GmbH,"Vaihingen, Stuttgart",DE,,,EUR,,0,,"Join TeamViewer, the leader in remote connectivity software. We harness the potential of cutting-edge technologies such as Augmented Reality and Artificial Intelligence to push the boundaries of innov...",2025-06-30,https://www.adzuna.de/details/5275263544?utm_medium=api&utm_source=44534cc0,2025-06-30T15:40:38.457390
5275263546,adzuna,"Vice President, Software Development - TeamViewer Frontline (all genders)",TeamViewer GmbH,"Lichtenberg, Berlin",DE,,,EUR,,0,,"Join TeamViewer, the leader in remote connectivity software. We harness the potential of cutting-edge technologies such as Augmented Reality and Artificial Intelligence to push the boundaries of innov...",2025-06-30,https://www.adzuna.de/details/5275263546?utm_medium=api&utm_source=44534cc0,2025-06-30T15:40:38.457390
5275263550,adzuna,"Intern, UX Design and Research (all genders)",TeamViewer GmbH,"Faurndau, Göppingen",DE,,,EUR,,0,,"Join TeamViewer, the leader in remote connectivity software. We harness the potential of cutting-edge technologies such as Augmented Reality and Artificial Intelligence to push the boundaries of innov...",2025-06-30,https://www.adzuna.de/details/5275263550?utm_medium=api&utm_source=44534cc0,2025-06-30T15:40:38.457390
5275263526,adzuna,(Senior) Full Stack Software Engineer (all genders),TeamViewer GmbH,"Faurndau, Göppingen",DE,,,EUR,,0,,"TeamViewer is a leading global technology company that provides a cutting-edge platform to remotely access, control and support devices of any kind. Our software solutions empower our users and custom...",2025-06-30,https://www.adzuna.de/details/5275263526?utm_medium=api&utm_source=44534cc0,2025-06-30T15:40:38.457390
5275263527,adzuna,(Full stack) Web Software Engineer (all genders) Frontline Assist AR,TeamViewer GmbH,"Faurndau, Göppingen",DE,,,EUR,,0,,"TeamViewer is a leading global technology company that provides a cutting-edge platform to remotely access, control, and support devices. Our software solutions empower our users and customers to brid...",2025-06-30,https://www.adzuna.de/details/5275263527?utm_medium=api&utm_source=44534cc0,2025-06-30T15:40:38.457390
5275263529,adzuna,(Senior) Full Stack Software Engineer (all genders),TeamViewer GmbH,"Vaihingen, Stuttgart",DE,,,EUR,,0,,"TeamViewer is a leading global technology company that provides a cutting-edge platform to remotely access, control and support devices of any kind. Our software solutions empower our users and custom...",2025-06-30,https://www.adzuna.de/details/5275263529?utm_medium=api&utm_source=44534cc0,2025-06-30T15:40:38.457390
5275263530,adzuna,(Senior) C++ Software Engineer (all genders),TeamViewer GmbH,"Faurndau, Göppingen",DE,,,EUR,C++,1,,"Join TeamViewer, the leader in remote connectivity software. We harness the potential of cutting-edge technologies such as Augmented Reality and Artificial Intelligence to push the boundaries of innov...",2025-06-30,https://www.adzuna.de/details/5275263530?utm_medium=api&utm_source=44534cc0,2025-06-30T15:40:38.457390
5275729529,adzuna,Senior Quality Engineer - Lending,N26 GmbH,Deutschland,DE,,,EUR,"Go, AI",2,,About the opportunity You will work in the Financial Empowerment domain. Our goal is to empower everyone to achieve financial freedom and unlock their potential for a better life by providing N26 user...,2025-06-30,https://www.adzuna.de/details/5275729529?utm_medium=api&utm_source=44534cc0,2025-06-30T15:40:46.676963
5275729460,adzuna,Cloud Engineer Aviation (m/w/d),CGI,Deutschland,DE,,,EUR,,0,,"Position Description: Programmieren ist dein Leben und du hast das Talent, immer innovative Lösungen zu finden? Dann werde Teil unserer Erfolgsgeschichte und gestalte mit uns in anspruchsvollen Projek...",2025-06-30,https://www.adzuna.de/details/5275729460?utm_medium=api&utm_source=44534cc0,2025-06-30T15:40:46.676963
5275724135,adzuna,Stellenangebot Software Engineer - React/JAVA (m/w/d) bei CHEFS CULINAR West GmbH & Co. KG,CITTI Handelsgesellschaft mbH u. Co. KG,"Weeze, Kleve (Kreis)",DE,,,EUR,"Java, React",2,,"Gestalte mit uns die Zukunft der Außer-Haus-Verpflegung! Wir, CHEFS VALUE, Teil der CHEFS CULINAR Unternehmensgruppe, stehen für umfassende Lösungen in den Bereichen Beratung, Schulung, smarte IT-Lösu...",2025-06-30,https://www.adzuna.de/details/5275724135?utm_medium=api&utm_source=44534cc0,2025-06-30T15:40:46.676963
5275723428,adzuna,Fullstack Softwareentwickler (m/w/d) | COBKOS,Atruvia,"Karlsruhe (Kreis), Baden-Württemberg",DE,,,EUR,,0,,Description Für unser Geschäftsfeld Core Banking im Tribe Kontoservices suchen wir dich in Voll- oder Teilzeit ab 30 Wochenstunden als Software Engineer Fullstack (m/w/d) in Karlsruhe bzw. Münster. De...,2025-06-30,https://www.adzuna.de/details/5275723428?utm_medium=api&utm_source=44534cc0,2025-06-30T15:40:46.676963
5275716208,adzuna,Senior Software Engineer (m/w/d) Frontend,Lübbers SLP,Deutschland,DE,,,EUR,,0,,Als Senior Software Engineer (m/w/d) Frontend bei Lübbers SLP in Dortmund sind Sie verantwortlich für die Entwicklung und Optimierung unserer modernen Webanwendungen. Sie arbeiten in einem dynamischen...,2025-06-30,https://www.adzuna.de/details/5275716208?utm_medium=api&utm_source=44534cc0,2025-06-30T15:40:46.676963
5275400508,adzuna,Senior Software Engineer (m/f/d),tado GmbH,"Moosach, München",DE,,,EUR,AI,1,,What you’ll be up to Tired of the same old tech landscape? We're a dynamic team looking for a sharp Senior Software Engineer (m/f/d) to shape our internal systems and drive real impact across all our ...,2025-06-30,https://www.adzuna.de/details/5275400508?utm_medium=api&utm_source=44534cc0,2025-06-30T15:40:46.676963
5275398641,adzuna,Software Engineer - GenAI (m/w/d),Ergo Group AG,"Altstadt-Nord, Köln",DE,,,EUR,AI,1,,Ihre zentrale Rolle:Durch Expertise in modernsten Technologien die Firma nachhaltig und ethisch weiterentwickelnFachliche Weiterentwicklung und Betreuung der Anwendungssysteme sowie Pflege von Regelwe...,2025-06-30,https://www.adzuna.de/details/5275398641?utm_medium=api&utm_source=44534cc0,2025-06-30T15:40:46.676963
5275398124,adzuna,Senior Software Engineer (Fullstack) (f/m/x),meinUnterricht GmbH,"Neukölln, Berlin",DE,,,EUR,AI,1,,"Job description meinUnterricht is an EdTech company that provides a comprehensive platform for lesson preparation. Our solution includes teaching materials, trainings, and tools that help teachers to ...",2025-06-30,https://www.adzuna.de/details/5275398124?utm_medium=api&utm_source=44534cc0,2025-06-30T15:40:46.676963
5275397906,adzuna,Senior Embedded Engineer (w/m/d) -C/C++,C.Ed. Schulte GmbH Zylinderschlossfabrik,"Langenhorst, Velbert",DE,,,EUR,C++,1,,"Ihre Aufgaben Für unsere Forschung und Entwicklung suchen wir einen begeisterten und innovativen Senior Embedded Software Engineer (m/w/d) – C/ C++, der bei der Gestaltung, Entwicklung und Pflege unse...",2025-06-30,https://www.adzuna.de/details/5275397906?utm_medium=api&utm_source=44534cc0,2025-06-30T15:40:46.676963
5275397386,adzuna,Software Engineer (Human) - Elixir,Eventinc GmbH,"Hamburg-Altstadt, Hamburg",DE,,,EUR,AI,1,,"Your role As a Software Engineer (Elixir) your mission is to craft the next generation of our Event Inc Platform, accelerate our company growth and reimagine business automations with AI tooling. You ...",2025-06-30,https://www.adzuna.de/details/5275397386?utm_medium=api&utm_source=44534cc0,2025-06-30T15:40:46.676963
5275287362,adzuna,Fachinformatiker für Anwendungsentwicklung (m/w/d) - Ausbildung,GAUSS-LVS mbH,"Paderborn (Kreis), Nordrhein-Westfalen",DE,,,EUR,,0,,"Einleitung Als zuverlässiger Partner für Case-Management-Lösungen öffentlicher Verwaltungen, sowie sozialer Einrichtungen, liefert die GAUSS-LVS mbH einen entscheidenden Beitrag für digitalisierte Soz...",2025-06-30,https://www.adzuna.de/details/5275287362?utm_medium=api&utm_source=44534cc0,2025-06-30T15:40:46.676963
5275286130,adzuna,PHP Software Engineer - Schwerpunkt Backend (m/w/d),campoint AG,"Seligenstadt, Offenbach (Kreis)",DE,,,EUR,PHP,1,,"Einleitung Die campoint AG ist nicht nur Pionier in der Betreuung von Online-Portalen, sie ist auch Experte aller Prozessschritte der Wertschöpfungskette im E-Commerce und entwickelt Lösungen für digi...",2025-06-30,https://www.adzuna.de/details/5275286130?utm_medium=api&utm_source=44534cc0,2025-06-30T15:40:46.676963
5275285751,adzuna,Software Engineer (m/w/d),ITB-GmbH,"Duisburg, Nordrhein-Westfalen",DE,,,EUR,,0,,Software Engineer (m/w/d) Wir sind ITB! Unsere Mission? Mit einem dynamischen Team von 75 talentierten Experten revolutionieren wir seit 1996 die Welt des Produktdatenmanagements. Bei uns sind Kunden ...,2025-06-30,https://www.adzuna.de/details/5275285751?utm_medium=api&utm_source=44534cc0,2025-06-30T15:40:46.676963
5275285546,adzuna,Senior Software Engineer – Automotive Infotainment (m/w/d),Krämer Automotive Systems GmbH,"Reutlingen (Kreis), Baden-Württemberg",DE,,,EUR,AI,1,,"Krämer Automotive - Wir arbeiten an den Herausforderungen der Zukunft! Wir sind ein namhafter Automobilzulieferer mit Sitz in Reutlingen, Baden-Württemberg. Als Tier-1-Lieferant sind wir spezialisiert...",2025-06-30,https://www.adzuna.de/details/5275285546?utm_medium=api&utm_source=44534cc0,2025-06-30T15:40:46.676963
5275283296,adzuna,Java Software Engineer Autorisierung (m/w/d),Finanz Informatik GmbH & Co. KG,"Frankfurt am Main, Hessen",DE,,,EUR,Java,1,,Als einer der größten Banken-IT-Dienstleister und Digitalisierungspartner Europas sind wir der Treiber der Digitalisierung innerhalb der Sparkassen-Finanzgruppe. Mit über 4.000 Mitarbeiter:innen an 3 ...,2025-06-30,https://www.adzuna.de/details/5275283296?utm_medium=api&utm_source=44534cc0,2025-06-30T15:40:46.677938
5275263540,adzuna,(Senior) Full Stack Software Engineer (all genders),TeamViewer GmbH,"Faurndau, Göppingen",DE,,,EUR,,0,,"Join TeamViewer, the leader in remote connectivity software. We harness the potential of cutting-edge technologies such as Augmented Reality and Artificial Intelligence to push the boundaries of innov...",2025-06-30,https://www.adzuna.de/details/5275263540?utm_medium=api&utm_source=44534cc0,2025-06-30T15:40:46.677938
5275263548,adzuna,(Senior) C++ Software Engineer (all genders),TeamViewer GmbH,"Vaihingen, Stuttgart",DE,,,EUR,C++,1,,"Join TeamViewer, the leader in remote connectivity software. We harness the potential of cutting-edge technologies such as Augmented Reality and Artificial Intelligence to push the boundaries of innov...",2025-06-30,https://www.adzuna.de/details/5275263548?utm_medium=api&utm_source=44534cc0,2025-06-30T15:40:46.677938
5275263531,adzuna,(Senior) C++ Software Engineer (all genders),TeamViewer GmbH,"Durlach, Karlsruhe",DE,,,EUR,C++,1,,"Join TeamViewer, the leader in remote connectivity software. We harness the potential of cutting-edge technologies such as Augmented Reality and Artificial Intelligence to push the boundaries of innov...",2025-06-30,https://www.adzuna.de/details/5275263531?utm_medium=api&utm_source=44534cc0,2025-06-30T15:40:46.677938
5275263535,adzuna,(Senior) Full Stack Software Engineer (all genders),TeamViewer GmbH,"Lichtenberg, Berlin",DE,,,EUR,,0,,"Join TeamViewer, the leader in remote connectivity software. We harness the potential of cutting-edge technologies such as Augmented Reality and Artificial Intelligence to push the boundaries of innov...",2025-06-30,https://www.adzuna.de/details/5275263535?utm_medium=api&utm_source=44534cc0,2025-06-30T15:40:46.677938
5275263537,adzuna,(Senior) Full Stack Software Engineer (all genders),TeamViewer GmbH,"Vaihingen, Stuttgart",DE,,,EUR,,0,,"Join TeamViewer, the leader in remote connectivity software. We harness the potential of cutting-edge technologies such as Augmented Reality and Artificial Intelligence to push the boundaries of innov...",2025-06-30,https://www.adzuna.de/details/5275263537?utm_medium=api&utm_source=44534cc0,2025-06-30T15:40:46.677938
5275263528,adzuna,(Full stack) Web Software Engineer (all genders) Frontline Assist AR,TeamViewer GmbH,"Durlach, Karlsruhe",DE,,,EUR,,0,,"TeamViewer is a leading global technology company that provides a cutting-edge platform to remotely access, control, and support devices. Our software solutions empower our users and customers to brid...",2025-06-30,https://www.adzuna.de/details/5275263528?utm_medium=api&utm_source=44534cc0,2025-06-30T15:40:46.677938
5275263533,adzuna,(Senior) C++ Software Engineer (all genders),TeamViewer GmbH,"Laim, München",DE,,,EUR,C++,1,,"Join TeamViewer, the leader in remote connectivity software. We harness the potential of cutting-edge technologies such as Augmented Reality and Artificial Intelligence to push the boundaries of innov...",2025-06-30,https://www.adzuna.de/details/5275263533?utm_medium=api&utm_source=44534cc0,2025-06-30T15:40:46.677938
5275263436,adzuna,Software Engineer - SAP Modern Frontend Development (m/w/d),Schwarz IT,"Weinsberg, Heilbronn (Kreis)",DE,,,EUR,,0,,"Die Schwarz IT betreut die gesamte digitale Infrastruktur und alle Softwarelösungen der Unternehmen der Schwarz Gruppe. Sie ist somit für Auswahl, Bereitstellung und Betrieb sowie Weiterentwicklung vo...",2025-06-30,https://www.adzuna.de/details/5275263436?utm_medium=api&utm_source=44534cc0,2025-06-30T15:40:46.677938
5275263431,adzuna,Fullstack Software Engineer - Fokus Frontend (Vue.js) (m/w/d),Schwarz IT,"Neckarsulm, Heilbronn (Kreis)",DE,,,EUR,Vue.js,1,,"Die Schwarz IT betreut die gesamte digitale Infrastruktur und alle Softwarelösungen der Unternehmen der Schwarz Gruppe. Sie ist somit für Auswahl, Bereitstellung und Betrieb sowie Weiterentwicklung vo...",2025-06-30,https://www.adzuna.de/details/5275263431?utm_medium=api&utm_source=44534cc0,2025-06-30T15:40:46.677938
5275258979,adzuna,Software Engineer (m/w/d) IT Air & Sea Logistics,DACHSER SE,"Bühl, Kempten (Allgäu)",DE,,,EUR,"Go, AI",2,,"Job ID 2664 / Vollzeit/ Teilzeit : Vollzeit / Job Kategorie : IT / Befristet/Unbefristet: Unbefristet „Logistics is people business“ – dieser Leitsatz macht deutlich, dass die Mitarbeitenden für DACHS...",2025-06-30,https://www.adzuna.de/details/5275258979?utm_medium=api&utm_source=44534cc0,2025-06-30T15:40:46.677938
5275250588,adzuna,"Junior Security Software Engineer (m/w/d) für cloudbasierte IAM-Lösungen - Anwendungsentwicklung, IT-Security, Ingenieur",Reply Deutschland SE,"Düsseldorf, Nordrhein-Westfalen",DE,,,EUR,"Go, DevOps",2,," Aufgaben - Du entwickelst und gestaltest cloudbasierte IAM-Lösungen unter Nutzung von OAuth2.0, OpenID Connect und SAML, um sichere und skalierbare Systeme bereitzustellen - Gemeinsam mit dem Team in...",2025-06-30,https://www.adzuna.de/details/5275250588?utm_medium=api&utm_source=44534cc0,2025-06-30T15:40:46.677938
5275250589,adzuna,"Junior Security Software Engineer (m/w/d) für cloudbasierte IAM-Lösungen - Anwendungsentwicklung, IT-Security, Ingenieur",Reply Deutschland SE,"Köln, Nordrhein-Westfalen",DE,,,EUR,"Go, DevOps",2,," Aufgaben - Du entwickelst und gestaltest cloudbasierte IAM-Lösungen unter Nutzung von OAuth2.0, OpenID Connect und SAML, um sichere und skalierbare Systeme bereitzustellen - Gemeinsam mit dem Team in...",2025-06-30,https://www.adzuna.de/details/5275250589?utm_medium=api&utm_source=44534cc0,2025-06-30T15:40:46.677938
5275250515,adzuna,"Fullstack Software Engineer - Fokus Frontend (Vue.js) (m/w/d) - Anwendungsentwicklung, Ingenieur",Schwarz Dienstleistungen,"Neckarsulm, Heilbronn (Kreis)",DE,,,EUR,Vue.js,1,,"Die Schwarz IT betreut die gesamte digitale Infrastruktur und alle Softwarelösungen der Unternehmen der Schwarz Gruppe. Sie ist somit für Auswahl, Bereitstellung und Betrieb sowie Weiterentwicklung vo...",2025-06-30,https://www.adzuna.de/details/5275250515?utm_medium=api&utm_source=44534cc0,2025-06-30T15:40:46.677938
5275250450,adzuna,"DevOps Engineer Software Platform (m/w/d) - System Engineering / Admin, Ingenieur",DFB,"Frankfurt am Main, Hessen",DE,,,EUR,"AI, DevOps",2,, Stelle Wir suchen zum nächstmöglichen Zeitpunkt in Vollzeit (40 Std./Woche) eine\*n DevOps Engineer Software Platform (m/w/d) am Standort Frankfurt am Main. Der Geschäftsbereich IT & Digitales verant...,2025-06-30,https://www.adzuna.de/details/5275250450?utm_medium=api&utm_source=44534cc0,2025-06-30T15:40:46.677938
5275250459,adzuna,"Software / Security Engineer* (m/w/d) - Anwendungsentwicklung, Ingenieur",Accso - Accelerated Solutions,"Frankfurt am Main, Hessen",DE,,,EUR,,0,,"Software / Security Engineer\*  Das erwartet dich bei uns: - Du arbeitest in Beratungs- und Softwareentwicklungsprojekten für Kunden wie der Bahn, der DSO oder dem ZDF - Du bringst Erfahrung und Exper...",2025-06-30,https://www.adzuna.de/details/5275250459?utm_medium=api&utm_source=44534cc0,2025-06-30T15:40:46.677938
5275250270,adzuna,"Senior Software Engineer Systems Identity- & Access-Management (m/w/d) | PLSIAM - Anwendungsentwicklung, Ingenieur",Atruvia AG,"Karlsruhe, Karlsruhe (Kreis)",DE,,,EUR,,0,,Wir sind der Digitalisierungspartner der genossenschaftlichen FinanzGruppe und vereinen jahrzehntelange Banking-Expertise mit moderner Informationstechnologie. Die speziell auf Banken zugeschnittenen ...,2025-06-30,https://www.adzuna.de/details/5275250270?utm_medium=api&utm_source=44534cc0,2025-06-30T15:40:46.677938
5275250272,adzuna,"Senior Software Engineer Systems Identity- & Access-Management (m/w/d) | PLSIAM - Anwendungsentwicklung, Ingenieur",Atruvia AG,"Berlin, Deutschland",DE,,,EUR,,0,,Wir sind der Digitalisierungspartner der genossenschaftlichen FinanzGruppe und vereinen jahrzehntelange Banking-Expertise mit moderner Informationstechnologie. Die speziell auf Banken zugeschnittenen ...,2025-06-30,https://www.adzuna.de/details/5275250272?utm_medium=api&utm_source=44534cc0,2025-06-30T15:40:46.677938
