id,source,title,company,location,country,salary_min,salary_max,currency,skills,skills_count,contract_type,description_excerpt,posted_date,url,collected_at
5274412842,adzuna,Senior Software Engineer (m/f/d) C# .NET,Verivox,"Bergheim, Heidelberg",DE,,,EUR,C#,1,,"Become part of the Verivox Team We are looking for you! We offer a full-time position (40h/week) as a Senior Software Engineer (m/f/d) in one of our locations in either Heidelberg, Berlin, Leipzig or ...",2025-06-29,https://www.adzuna.de/details/5274412842?utm_medium=api&utm_source=44534cc0,2025-06-30T15:40:50.381403
5274412678,adzuna,Control Software Engineer (m/w/d),ST Engineering Applied Solutions GmbH,"Mörfelden-Walldorf, Groß-Gerau (Kreis)",DE,,,EUR,AI,1,,"Das packst Du an: Entwicklung von Steuerungssoftware und Treibern für vollautomatische Robotersysteme, die einen effizienten und zuverlässigen Betrieb gewährleisten Lieferung vollständiger, getesteter...",2025-06-29,https://www.adzuna.de/details/5274412678?utm_medium=api&utm_source=44534cc0,2025-06-30T15:40:54.853405
5274412648,adzuna,Senior Software Engineer (m/f/d) PHP,Verivox,"Bergheim, Heidelberg",DE,,,EUR,PHP,1,,"Become part of the Verivox Team We are looking for you! We offer a full-time position (40h/week) as a Senior Software Engineer (m/f/d) PHP in one of our locations in either Heidelberg, Berlin, Leipzig...",2025-06-29,https://www.adzuna.de/details/5274412648?utm_medium=api&utm_source=44534cc0,2025-06-30T15:40:54.853405
5274411950,adzuna,Software Engineer PHP Fullstack (m/f/d),Ratepay GmbH,"Kreuzberg, Berlin",DE,,,EUR,"Java, PHP, AI",3,,"Your Mission At Ratepay, we are dedicated to revolutionizing the world of digital payments. Established in 2009, we have grown to become Europe's leading white-label Buy Now Pay Later payment provider...",2025-06-29,https://www.adzuna.de/details/5274411950?utm_medium=api&utm_source=44534cc0,2025-06-30T15:40:54.853405
5274411934,adzuna,"Senior Software Engineer (m/f/d) NodeJS, DevOps",Verivox,"Bergheim, Heidelberg",DE,,,EUR,"AI, DevOps",2,,"Become part of the Verivox Team We are looking for you! We offer a full-time position (40h/week) in one of our locations in either Heidelberg, Berlin, Leipzig or Munich . The offer includes the option...",2025-06-29,https://www.adzuna.de/details/5274411934?utm_medium=api&utm_source=44534cc0,2025-06-30T15:40:54.853405
5274411898,adzuna,Robotics Software Engineer (m/f/d),FRANKA ROBOTICS GmbH,"Maxvorstadt, München",DE,,,EUR,"Go, AI",2,,"Your role As a senior member of the Motion and Tactility team, you will help shape the future of robotics by advancing high-performance motion control and command interfaces for collaborative robots. ...",2025-06-29,https://www.adzuna.de/details/5274411898?utm_medium=api&utm_source=44534cc0,2025-06-30T15:40:54.853405
5274217188,adzuna,Senior Software Engineer UI/UX (d/w/m),Leica Microsystems,"Wetzlar, Lahn-Dill-Kreis",DE,,,EUR,,0,,Seit über 170 Jahren gestaltet Leica Microsystems mit bahnbrechenden optischen und digitalen Lösungen die Zukunft der Mikroskopie mit. Als ein global führendes Unternehmen setzen wir auf kontinuierlic...,2025-06-29,https://www.adzuna.de/land/ad/5274217188?se=ykKP17dV8BGk5ZKCaDeyaQ&utm_medium=api&utm_source=44534cc0&v=6132F03A26D38FCFA7390E572A878AA3C9218C23,2025-06-30T15:40:54.853405
5274213642,adzuna,"Software Engineer - .NET (m/w/d) - Anwendungsentwicklung, Ingenieur",CGI Deutschland,"Stuttgart, Baden-Württemberg",DE,,,EUR,,0,, Position Description: Wir als CGI bieten unseren Kunden Beratung und Dienstleistungen im IT-Bereich sowohl in Deutschland als auch weltweit. Dabei arbeiten wir gemeinsam mit den Kunden an komplexen S...,2025-06-29,https://www.adzuna.de/details/5274213642?utm_medium=api&utm_source=44534cc0,2025-06-30T15:40:54.853405
5274213633,adzuna,"Software Engineer - .NET (m/w/d) - Anwendungsentwicklung, Ingenieur",CGI Deutschland,"Karlsruhe, Karlsruhe (Kreis)",DE,,,EUR,,0,, Position Description: Wir als CGI bieten unseren Kunden Beratung und Dienstleistungen im IT-Bereich sowohl in Deutschland als auch weltweit. Dabei arbeiten wir gemeinsam mit den Kunden an komplexen S...,2025-06-29,https://www.adzuna.de/details/5274213633?utm_medium=api&utm_source=44534cc0,2025-06-30T15:40:54.853405
5274213640,adzuna,"Software Engineer Cloud (all genders) - Anwendungsentwicklung, Ingenieur",baramundi software GmbH,"Augsburg, Augsburg (Kreis)",DE,,,EUR,,0,, Willkommen bei baramundi! “Willkommen in der Welt der Innovation und Vielfalt!” Der Software-Markt entwickelt sich rasant weiter – und unser Entwicklungs-Team ist immer vorne mit dabei. Zur Verstärku...,2025-06-29,https://www.adzuna.de/details/5274213640?utm_medium=api&utm_source=44534cc0,2025-06-30T15:40:54.853405
5274213615,adzuna,"Software Engineer - .NET (m/w/d) - Anwendungsentwicklung, Ingenieur",CGI Deutschland,"Mannheim, Baden-Württemberg",DE,,,EUR,,0,, Position Description: Wir als CGI bieten unseren Kunden Beratung und Dienstleistungen im IT-Bereich sowohl in Deutschland als auch weltweit. Dabei arbeiten wir gemeinsam mit den Kunden an komplexen S...,2025-06-29,https://www.adzuna.de/details/5274213615?utm_medium=api&utm_source=44534cc0,2025-06-30T15:40:54.853405
5274213431,adzuna,"Machine Learning Engineer AI Forecasting (m/w/d) - System Engineering / Admin, Ingenieur",Schwarz Dienstleistungen,"Heilbronn, Heilbronn (Kreis)",DE,,,EUR,"Machine Learning, AI",2,,"Die Schwarz IT betreut die gesamte digitale Infrastruktur und alle Softwarelösungen der Unternehmen der Schwarz Gruppe. Sie ist somit für Auswahl, Bereitstellung und Betrieb sowie Weiterentwicklung vo...",2025-06-29,https://www.adzuna.de/details/5274213431?utm_medium=api&utm_source=44534cc0,2025-06-30T15:40:54.853405
5274213399,adzuna,"Software Engineer Flutter (m/w/d) - Anwendungsentwicklung, Ingenieur",REWE digital GmbH,"Köln, Nordrhein-Westfalen",DE,,,EUR,,0,,"Du bist davon überzeugt, dass Lebensmittel nicht tausende Kilometer reisen müssen, um auf deinem Teller zu landen? Du möchtest dazu beitragen, dass gesunde, hochwertige Produkte aus der Region überall...",2025-06-29,https://www.adzuna.de/details/5274213399?utm_medium=api&utm_source=44534cc0,2025-06-30T15:40:54.853405
5274197510,adzuna,"Senior Water Solutions Manager, AWS Energy & Water Team",A100 ROW GmbH,"Frankfurt am Main, Hessen",DE,,,EUR,AWS,1,,"Amazon is looking for a results-oriented individual to join the AWS water infrastructure team. In this role, you will provide engineering and due diligence support for AWS’s new and existing projects ...",2025-06-29,https://www.adzuna.de/details/5274197510?utm_medium=api&utm_source=44534cc0,2025-06-30T15:40:54.853405
5273642529,adzuna,AI Software Engineer - Full Stack,GoTo,"Dresden, Sachsen",DE,,,EUR,"Go, AI",2,,"Job Description Where you will work: anywhere within Germany Engineering at GoTo *?* ? We're the trailblazers of remote work technology. We build powerful, flexible work software that empowers everyon...",2025-06-28,https://www.adzuna.de/details/5273642529?utm_medium=api&utm_source=44534cc0,2025-06-30T15:40:54.853405
5273638772,adzuna,"Sr. Software Development Engineer, Aurora Engineering",Amazon,"Berlin, Deutschland",DE,,,EUR,"MySQL, AWS, AI",3,,Description Are you interested in building hyper-scale database services in the cloud? Do you want to revolutionize the way databases are built for the cloud ? Do you want to have direct and immediate...,2025-06-28,https://www.adzuna.de/details/5273638772?utm_medium=api&utm_source=44534cc0,2025-06-30T15:40:54.853405
5273638206,adzuna,"Systems Engineer, Managed Operations",Amazon,"Berlin, Deutschland",DE,,,EUR,"AWS, AI",2,,"Description AWS is set to introduce the inaugural European Sovereign Cloud (ESC), marking a significant development in utility computing (UC). To spearhead this initiative, we are actively seeking exp...",2025-06-28,https://www.adzuna.de/details/5273638206?utm_medium=api&utm_source=44534cc0,2025-06-30T15:40:54.853405
5273637163,adzuna,"Chief Engineer - Data Center Engineering Operations (m/f), DC Engineering and Facility Operations",Amazon,"Frankfurt am Main, Hessen",DE,,,EUR,"AWS, AI",2,,"Description AWS Infrastructure Services owns the design, planning, delivery, and operation of all AWS global infrastructure. In other words, we're the people who keep the cloud running. We support all...",2025-06-28,https://www.adzuna.de/details/5273637163?utm_medium=api&utm_source=44534cc0,2025-06-30T15:40:54.853405
5273607509,adzuna,Software Engineer Smalltalk (m/w/d),recruitIT Consulting,"Benninghofen, Dortmund",DE,65000.0,80000.0,EUR,,0,permanent,Software Engineer Smalltalk (m/w/d) 40 Stunden pro Woche • unbefristet • Frühester Beginn ab 2025-07-01 65.000 - 80.000 EUR pro Jahr Ein innovatives Softwareunternehmen gestaltet die Versicherungswelt...,2025-06-28,https://www.adzuna.de/details/5273607509?utm_medium=api&utm_source=44534cc0,2025-06-30T15:40:54.853405
5273414143,adzuna,Lead Software Engineer (JAVA/ GIS) (m/f/x),HERE,"Schwalbach am Taunus, Main-Taunus-Kreis",DE,,,EUR,"Java, Go",2,,You will be part of a motivated engineering team working on map data processing. The team is responsible for a data onboarding and updating software stack and is integrated in the context of Mapmaking...,2025-06-28,https://www.adzuna.de/details/5273414143?utm_medium=api&utm_source=44534cc0,2025-06-30T15:40:54.853405
5273351797,adzuna,Lead Backend Software Engineer,Find Labs,Deutschland,DE,80000.0,80000.0,EUR,AI,1,,Find Labs are a team of builders and technologists united in the mission of helping companies and projects innovate by providing them with customised blockchain infrastructure that aligns with their v...,2025-06-28,https://www.adzuna.de/details/5273351797?utm_medium=api&utm_source=44534cc0,2025-06-30T15:40:54.853405
5273347650,adzuna,(Senior) Software Engineer (M/F/D),Adtran Networks,"Meiningen, Schmalkalden-Meiningen (Kreis)",DE,,,EUR,,0,,"Welcome! Our Growth is Creating Great Opportunities! Our team is expanding, and we want to hire the most talented people we can. Continued success depends on it! Once you've had a chance to explore ou...",2025-06-28,https://www.adzuna.de/details/5273347650?utm_medium=api&utm_source=44534cc0,2025-06-30T15:40:54.853405
5273347617,adzuna,Lead Software Engineer Frontend (m/w/d),DATEV,Deutschland,DE,,,EUR,,0,,Das ist das Arbeitsumfeld: Als Lead Software Engineer in der Frontend-Entwicklung (m/w/d) übernimmst Du eine zentrale Führungsrolle in der Weiterentwicklung unserer Frontend-Strategie und -Technologie...,2025-06-28,https://www.adzuna.de/details/5273347617?utm_medium=api&utm_source=44534cc0,2025-06-30T15:40:54.853405
5273347056,adzuna,Machine Learning Operations Engineer (m/f/d),Stark,"Berlin, Deutschland",DE,,,EUR,"Machine Learning, AI",2,,"About Us STARK is a new kind of defence technology company revolutionizing the way autonomous systems are deployed across multiple domains. We design, develop and manufacture high performance unmanned...",2025-06-28,https://www.adzuna.de/details/5273347056?utm_medium=api&utm_source=44534cc0,2025-06-30T15:40:54.853405
5273346465,adzuna,(Senior) Software Engineer (m/w/d),Verlag C.H.Beck,"Schwabing-Freimann, München",DE,,,EUR,,0,,"Die Mediengruppe C.H.BECK steht seit über 250 Jahren als traditionsreiches Familienunternehmen für Verlässlichkeit, Innovation und höchste Qualität. Sie zeichnet sich durch ein breites Portfolio aus, ...",2025-06-28,https://www.adzuna.de/details/5273346465?utm_medium=api&utm_source=44534cc0,2025-06-30T15:40:54.853405
5273346113,adzuna,"Engineering Manager, Information Security Engineering Cryptography",Google,"München, München (Kreis)",DE,,,EUR,"Python, JavaScript, Java, C++",4,,"Minimum qualifications: Bachelor’s degree, or equivalent practical experience. 8 years of experience with software development in one or more programming languages (e.g., Python, C, C++, Java, JavaScr...",2025-06-28,https://www.adzuna.de/details/5273346113?utm_medium=api&utm_source=44534cc0,2025-06-30T15:40:54.853405
5273345725,adzuna,Sr. Software Development Engineer - backend,LivePerson,Deutschland,DE,,,EUR,AI,1,,"LivePerson (NASDAQ: LPSN) is the global leader in enterprise conversations. Hundreds of the world’s leading brands — including HSBC, Chipotle, and Virgin Media — use our award-winning Conversational C...",2025-06-28,https://www.adzuna.de/details/5273345725?utm_medium=api&utm_source=44534cc0,2025-06-30T15:40:54.853405
5273345521,adzuna,Senior Applied Scientist (Scaling Deep Learning Experimentation) - Size & Fit (All Genders),Zalando SE,"Berlin, Deutschland",DE,,,EUR,,0,,At Zalando we believe that an article that doesn’t fit well is the wrong article for our customers. As a Senior Applied Scientist in the Size and Fit organisation you will use our unique datasets to d...,2025-06-28,https://www.adzuna.de/details/5273345521?utm_medium=api&utm_source=44534cc0,2025-06-30T15:40:54.853405
5273345375,adzuna,Senior Python Software Engineer | ML Team (m/w/d),neoshare,"München, München (Kreis)",DE,,,EUR,"Python, Machine Learning, AI",3,,"Your mission You will design and develop machine learning and AI-driven systems. You will collaborate with machine learning and data engineers. You will build robust, scalable, and production-ready so...",2025-06-28,https://www.adzuna.de/details/5273345375?utm_medium=api&utm_source=44534cc0,2025-06-30T15:40:54.853405
5273345159,adzuna,"Software Engineer III (cheminformatics, Java)",Elsevier Company,Deutschland,DE,,,EUR,"Java, React, AI",3,,"Company: Elsevier Position: Software Engineer III (cheminformatics, Java) (m/f/d) Location: Frankfurt am Main, hybrid About Reaxys R eaxys is a comprehensive and powerful cloud hosted and deep-tech da...",2025-06-28,https://www.adzuna.de/details/5273345159?utm_medium=api&utm_source=44534cc0,2025-06-30T15:40:54.853405
5273344779,adzuna,"Software Engineer II, Full Stack, Cloud",Google,"München, München (Kreis)",DE,,,EUR,"Python, JavaScript, Java, C++, Go",5,,"Minimum qualifications: Bachelor’s degree or equivalent practical experience. 1 year of experience with software development in one or more programming languages (e.g., Python, C, C++, Java, JavaScrip...",2025-06-28,https://www.adzuna.de/details/5273344779?utm_medium=api&utm_source=44534cc0,2025-06-30T15:40:54.853405
5273344371,adzuna,Software Engineer / .Net Developer (m/f/d),SimonsVoss Technologies,"Unterföhring, München (Kreis)",DE,,,EUR,,0,,"Creating Peace of Mind by Pioneering Safety and Security At Allegion, we help keep the people you know and love safe and secure where they live, work and visit. With more than 30 brands, 12,000 employ...",2025-06-28,https://www.adzuna.de/details/5273344371?utm_medium=api&utm_source=44534cc0,2025-06-30T15:40:54.853405
5273342689,adzuna,Software Engineer IoT (m/w/d),SMIGHT,"Karlsruhe, Karlsruhe (Kreis)",DE,,,EUR,,0,,"Dein Ziel Als Software Engineer IoT sorgst Du dafür, dass die an vielen tausenden Knoten im Niederspannungsnetz gemessenen Daten zuverlässig ins Backend übertragen werden und für eine Weiterverarbeitu...",2025-06-28,https://www.adzuna.de/details/5273342689?utm_medium=api&utm_source=44534cc0,2025-06-30T15:40:54.853405
5273339758,adzuna,Stellenangebot Software Engineer (m/w/d) bei CHEFS CULINAR West GmbH & Co. KG,CITTI Handelsgesellschaft mbH u. Co. KG,"Weeze, Kleve (Kreis)",DE,,,EUR,Agile,1,,"Über 7.700 Menschen freuen sich darauf, Deine Kollegen zu werden! Seit über 100 Jahren ist CHEFS CULINAR vertrauter Partner für Kunden aus der Hotellerie und Gastronomie, sowie der Gemeinschaftsverpfl...",2025-06-28,https://www.adzuna.de/details/5273339758?utm_medium=api&utm_source=44534cc0,2025-06-30T15:40:54.853405
5273339291,adzuna,Flight Test Engineer,Stark,"München, München (Kreis)",DE,,,EUR,AI,1,,"About Us STARK is a new kind of defence technology company revolutionizing the way autonomous systems are deployed across multiple domains. We design, develop and manufacture high performance unmanned...",2025-06-28,https://www.adzuna.de/details/5273339291?utm_medium=api&utm_source=44534cc0,2025-06-30T15:40:54.853405
5273339116,adzuna,Software Engineer (all genders) - Lounge by Zalando,Zalando SE,"Berlin, Deutschland",DE,,,EUR,AI,1,,"THE ROLE & THE TEAM Lounge by Zalando is a rapidly growing part of Zalando, now turning over billions of euros each year. That said, there is so much untapped potential with respect to personalization...",2025-06-28,https://www.adzuna.de/details/5273339116?utm_medium=api&utm_source=44534cc0,2025-06-30T15:40:54.853405
5273339049,adzuna,Senior Software Engineer (M/F/D),Adtran Networks,"Meiningen, Schmalkalden-Meiningen (Kreis)",DE,,,EUR,,0,,"Welcome! Our Growth is Creating Great Opportunities! Our team is expanding, and we want to hire the most talented people we can. Continued success depends on it! Once you've had a chance to explore ou...",2025-06-28,https://www.adzuna.de/details/5273339049?utm_medium=api&utm_source=44534cc0,2025-06-30T15:40:54.854411
5273338464,adzuna,Senior Software Engineer - Identity & Access Management (all genders),Zalando SE,"Berlin, Deutschland",DE,,,EUR,,0,,"THE ROLE & THE TEAM Identity and Access Management (IAM) is a key technology at Zalando, providing secure access to our Zalando Technology Foundation services and tools for our employees, partnering b...",2025-06-28,https://www.adzuna.de/details/5273338464?utm_medium=api&utm_source=44534cc0,2025-06-30T15:40:54.854411
5273337662,adzuna,Software Backend/Data Engineer (all genders),Zalando SE,"Berlin, Deutschland",DE,,,EUR,,0,,"THE ROLE & THE TEAM Imagine being at the heart of a dynamic team, where your expertise directly fuels our customer’s return experience. As a Data Engineer in our Returns team, you'll be more than just...",2025-06-28,https://www.adzuna.de/details/5273337662?utm_medium=api&utm_source=44534cc0,2025-06-30T15:40:54.854411
5273332562,adzuna,Principal Software Engineer - ZEOS (all genders),Zalando SE,"Berlin, Deutschland",DE,,,EUR,,0,,"THE ROLE & THE TEAM At ZEOS , we've found that a big part of our platform's success comes from solving logistics challenges in ways that truly benefit our customers. As our partner community expands, ...",2025-06-28,https://www.adzuna.de/details/5273332562?utm_medium=api&utm_source=44534cc0,2025-06-30T15:40:54.854411
5273330770,adzuna,Senior Software Engineer iOS - Lounge by Zalando (all genders),Zalando SE,"Berlin, Deutschland",DE,,,EUR,AI,1,,"THE ROLE & THE TEAM Lounge by Zalando, Zalando’s second biggest customer-facing destination, drives Zalando’s mission as Europe’s starting point for fashion. Serving millions daily, we offer unique us...",2025-06-28,https://www.adzuna.de/details/5273330770?utm_medium=api&utm_source=44534cc0,2025-06-30T15:40:54.854411
5273330548,adzuna,Staff Frontend Software Engineer,Synthflow AI,"Berlin, Deutschland",DE,,,EUR,AI,1,,Synthflow AI is a no-code platform for deploying voice AI agents that automate phone calls across contact center operations and business process outsourcing (BPO) at scale. We help mid-market and ente...,2025-06-28,https://www.adzuna.de/details/5273330548?utm_medium=api&utm_source=44534cc0,2025-06-30T15:40:54.854411
5273330519,adzuna,Mission Software Systems Engineer (all genders),Reflex Aerospace,"Berlin, Deutschland",DE,,,EUR,,0,,Join the Pinnacle of Satellite Technology Advancement in Germany! Reflex Aerospace is at the forefront of propelling high-performance satellite technology to new heights within the German aerospace la...,2025-06-28,https://www.adzuna.de/details/5273330519?utm_medium=api&utm_source=44534cc0,2025-06-30T15:40:54.854411
5273330436,adzuna,Software Backend Engineer - Lounge by Zalando (all genders),Zalando SE,"Berlin, Deutschland",DE,,,EUR,AI,1,,"HE ROLE & THE TEAM As a Software Engineer in Lounge Supply you will join a team that is serious about design, rock solid APIs and fun. You will join a team that is responsible for developing tooling t...",2025-06-28,https://www.adzuna.de/details/5273330436?utm_medium=api&utm_source=44534cc0,2025-06-30T15:40:54.854411
5273330305,adzuna,Head of CRM Systems (m/w/d),Thermondo,"Kreuzberg, Berlin",DE,,,EUR,,0,,"We're looking for Join our innovative team at thermondo as a Head of CRM Systems and make a significant impact in reducing carbon footprints in private households. With your expertise, you will collab...",2025-06-28,https://www.adzuna.de/details/5273330305?utm_medium=api&utm_source=44534cc0,2025-06-30T15:40:54.854411
5273329977,adzuna,Software Engineer /Machine Learning - Lounge by Zalando (all genders),Zalando SE,"Berlin, Deutschland",DE,,,EUR,"Machine Learning, AI",2,,"ABOUT LOUNGE BY ZALANDO Lounge by Zalando is an online outlet for fashion and lifestyle products in 17 European countries. We offer our members daily, time-limited sale campaigns with discounts of up ...",2025-06-28,https://www.adzuna.de/details/5273329977?utm_medium=api&utm_source=44534cc0,2025-06-30T15:40:54.854411
5273329042,adzuna,Software Engineer (m/f/d),GKN Automotive,"Lohmar, Rhein-Sieg-Kreis",DE,,,EUR,,0,,Description Lohmar site – hybrid working (3 days on site) Reports to: Teamleader Software Development and Integration Application closing date: Sunday 27th July Here at GKN Automotive we work at the f...,2025-06-28,https://www.adzuna.de/details/5273329042?utm_medium=api&utm_source=44534cc0,2025-06-30T15:40:54.854411
5273323081,adzuna,Staff - Software Development Engineer,Viavi Solutions Deutschland,Deutschland,DE,,,EUR,,0,,"Summary: VIAVI has a 100 year history of technical innovations that have evolved to keep pace and address our customers’ most pressing business issues. We make equipment, software, and systems that he...",2025-06-28,https://www.adzuna.de/details/5273323081?utm_medium=api&utm_source=44534cc0,2025-06-30T15:40:54.854411
5273321150,adzuna,Embedded Software Engineer,Stark,"München, München (Kreis)",DE,,,EUR,AI,1,,"About Us STARK is a new kind of defence technology company revolutionizing the way autonomous systems are deployed across multiple domains. We design, develop and manufacture high performance unmanned...",2025-06-28,https://www.adzuna.de/details/5273321150?utm_medium=api&utm_source=44534cc0,2025-06-30T15:40:54.854411
5273320955,adzuna,"Senior Mechatronics/Mechanical Engineer (Sensor Technology, Automation, Precision Engineering)",QuantumDiamonds,"Au-Haidhausen, München",DE,,,EUR,,0,,"Description We are seeking a skilled mechatronics or mechanical engineer to support the development and automation of our quantum sensing measurement systems. In this role, you will design and optimiz...",2025-06-28,https://www.adzuna.de/details/5273320955?utm_medium=api&utm_source=44534cc0,2025-06-30T15:40:54.854411
5273320836,adzuna,IT Professional / Software Engineer (w/m/d) - Digitalisierung,SpiraTec AG,Deutschland,DE,,,EUR,,0,,"Sei Teil eines zukunftsorientierten Unternehmens und setze mit uns innovative Lösungen auf Basis von neuesten Technologien und Ansätze (Digitalisierung, Industrie 4.0) um. Du setzt Projekte um und ent...",2025-06-28,https://www.adzuna.de/details/5273320836?utm_medium=api&utm_source=44534cc0,2025-06-30T15:40:54.854411
5273314707,adzuna,Senior Full Stack Software Engineer (f/m/d),Circus,"HafenCity, Hamburg",DE,,,EUR,AI,1,,"Our Mission At Circus (Xetra: CA1), headquartered in Hamburg with offices in Berlin and Munich, we are pioneering global developments in on-demand autonomous food production. Everything from creation ...",2025-06-28,https://www.adzuna.de/details/5273314707?utm_medium=api&utm_source=44534cc0,2025-06-30T15:40:57.902630
5273313386,adzuna,Senior Software Engineer (all genders) - Backend,Tradebyte Software,Deutschland,DE,,,EUR,"Go, AI",2,,"ABOUT TRADEBYTE At Tradebyte, we work with the biggest players in e-commerce - from trendsetting fashion brands to major online retailers. Our goal is to create a workplace where everyone feels valued...",2025-06-28,https://www.adzuna.de/details/5273313386?utm_medium=api&utm_source=44534cc0,2025-06-30T15:40:57.902630
5273312999,adzuna,Initiativbewerbung - Softwareentwickler (m/w/d) - Fokus Typescript / React / Next.js,HÖRMANN Digital,"München, München (Kreis)",DE,,,EUR,React,1,,Deine Expertise ist gefragt: (Junior/Senior) Software Engineer / Entwickler (m/w/d) bei HÖRMANN Digital in München gesucht – Nimm die Herausforderung an und treibe die digitale Transformation bei HÖRM...,2025-06-28,https://www.adzuna.de/details/5273312999?utm_medium=api&utm_source=44534cc0,2025-06-30T15:40:57.902630
5273312953,adzuna,Software Engineer (LS) (all genders),Zalando SE,"Berlin, Deutschland",DE,,,EUR,Go,1,,"ROLE AND TEAM As a Software Engineer, you will be part of an expert team of software engineers and applied scientists working towards keeping the delivery time promise for all Zalando customers. Your ...",2025-06-28,https://www.adzuna.de/details/5273312953?utm_medium=api&utm_source=44534cc0,2025-06-30T15:40:57.902630
5273311968,adzuna,Senior Fullstack Engineer (f/m/x),exmox,"Hamburg-Altstadt, Hamburg",DE,,,EUR,,0,,"Your mission You actively shape your position, we want you to get involved and contribute ideas! Work in a cross-functional team, combining your expertise with your team members to ensure rapid featur...",2025-06-28,https://www.adzuna.de/details/5273311968?utm_medium=api&utm_source=44534cc0,2025-06-30T15:40:57.902630
5273301071,adzuna,Senior Software Engineer,Proxima Fusion,"München, München (Kreis)",DE,,,EUR,AI,1,,"WHO WE ARE At Proxima Fusion, we're driven by a bold mission – to redefine the future of sustainable energy. Our unique concept, built upon the groundbreaking W7-X stellarator and the latest advances ...",2025-06-28,https://www.adzuna.de/details/5273301071?utm_medium=api&utm_source=44534cc0,2025-06-30T15:40:57.902630
