id,source,title,company,location,country,salary_min,salary_max,currency,skills,skills_count,contract_type,description_excerpt,posted_date,url,collected_at
5275725212,adzuna,Senior Psychologist (Mat Leave Cover FT/ PT),Elysium Healthcare,"Hawton, Newark",GB,0.0,57220.0,GBP,,0,contract,Are you an experienced Senior Clinical Psychologist looking for a rewarding career where you can make a difference and changes lives for the better? Join the team at The Farndon Unit and enjoy support...,2025-06-30,https://www.adzuna.co.uk/jobs/details/5275725212?utm_medium=api&utm_source=44534cc0,2025-06-30T15:42:51.091970
5275725276,adzuna,Production Line Leader,Crooton,"Peterborough, Eastern England",GB,27456.0,32032.0,GBP,AI,1,permanent,"Production Line Leader, Days Location: Peterborough, Cambridgeshire Salary: £13.20 – £15.40 per hour (DOE) - Paid Weekly. Schedule: 4 on, 4 off – Day Shifts (5:45 am - 6:15 pm) Job Type: Full-time, Pe...",2025-06-30,https://www.adzuna.co.uk/jobs/details/5275725276?utm_medium=api&utm_source=44534cc0,2025-06-30T15:42:51.091970
5275725218,adzuna,Support Worker,Voyage Care,"Framingham Pigot, Norwich",GB,12.0,12.0,GBP,,0,,Female Support Worker Framingham Earl - £12.55 h Typical Shifts are: Typical Shifts are: Monday-Sunday 8am-3pm & 3pm-10pm plus Sleep ins. MUST have a valid Full UK driving licence to drive our vehicle...,2025-06-30,https://www.adzuna.co.uk/jobs/details/5275725218?utm_medium=api&utm_source=44534cc0,2025-06-30T15:42:51.091970
5275725234,adzuna,Kitchen Porter - PT,Franco Manca,"Hillhead, Glasgow City Centre",GB,25480.0,25480.0,GBP,,0,,"About Us : At Franco Manca, we don’t just serve pizza – we serve up passion, authenticity, and great vibes. From our signature slow-rising sourdough to the freshest seasonal ingredients, we’re dedicat...",2025-06-30,https://www.adzuna.co.uk/jobs/details/5275725234?utm_medium=api&utm_source=44534cc0,2025-06-30T15:42:51.091970
5275725241,adzuna,Activities Co-ordinator,Elysium Healthcare,UK,GB,25936.0,25936.0,GBP,,0,,"Being an Activities Coordinator is so much more than just organising programmes. It's providing care and support to some of the most vulnerable people in society. Wo rking 37.5 hours a week, you will ...",2025-06-30,https://www.adzuna.co.uk/jobs/details/5275725241?utm_medium=api&utm_source=44534cc0,2025-06-30T15:42:51.091970
5275725252,adzuna,Wellbeing and Activities Assistant,Avery Healthcare,"Walkley, Sheffield",GB,25417.0,25417.0,GBP,AI,1,,"Package Description: Shift Details: 2 days 9.30 till 5.30 pm, 1 day 9.30 till 6 pm, 1 day 11.30 till 8.00 pm & 1 weekend in three At Avery Healthcare, we are all about supporting the people who care f...",2025-06-30,https://www.adzuna.co.uk/jobs/details/5275725252?utm_medium=api&utm_source=44534cc0,2025-06-30T15:42:51.091970
5275725283,adzuna,Support Worker,Voyage Care,"West Horndon, Brentwood",GB,12.0,12.0,GBP,,0,,"Support Worker Brentwood - £12.67ph - Driver required Driver are essential for this role and must have access to their own vehicles. Shift patterns include: Early, Lates, weekend working, occasional n...",2025-06-30,https://www.adzuna.co.uk/jobs/details/5275725283?utm_medium=api&utm_source=44534cc0,2025-06-30T15:42:51.091970
5275725223,adzuna,Machine Minder,2 Sisters Food Group,"Tiverton Junction, Cullompton",GB,13.0,,GBP,AI,1,permanent,"We currently have a permanent opportunity for an Machine Minder to join our Portions teams in Willand, Devon. This post is working Days, Monday to Friday The hours of work and shift patterns available...",2025-06-30,https://www.adzuna.co.uk/jobs/details/5275725223?utm_medium=api&utm_source=44534cc0,2025-06-30T15:42:51.091970
5275725239,adzuna,Housekeeper,Shepherd Neame,"Richborough, Sandwich",GB,22830.12,22830.12,GBP,Go,1,,"Shepherd Neame is on the lookout for a part time Housekeeper to join our team, so if you enjoy hospitality but prefer working behind the scenes supporting your colleagues and contributing to the teams...",2025-06-30,https://www.adzuna.co.uk/jobs/details/5275725239?utm_medium=api&utm_source=44534cc0,2025-06-30T15:42:51.091970
5275725253,adzuna,Support Worker,Voyage Care,"Bolsover, Chesterfield",GB,12.0,12.0,GBP,,0,,"Support Worker Bolsover, Chesterfield - £12.22 per hour, up to £13.22 with enhancements Typical Shifts on a rota basis are: 7:30am - 2:30pm, 2:30pm - 9:30pm and 9:30pm 7:30am. Join Voyage Care and Fee...",2025-06-30,https://www.adzuna.co.uk/jobs/details/5275725253?utm_medium=api&utm_source=44534cc0,2025-06-30T15:42:51.091970
5275725220,adzuna,Hygiene Team Leader,2 Sisters Food Group,"Tiverton Junction, Cullompton",GB,27747.0,27747.0,GBP,AI,1,permanent,"Come and join us! We currently have exciting/permanent opportunity for a Hygiene Team Leader to join our team in Willand, Devon. This post is working days The hours of work and shift patterns are: 5am...",2025-06-30,https://www.adzuna.co.uk/jobs/details/5275725220?utm_medium=api&utm_source=44534cc0,2025-06-30T15:42:51.091970
5275725277,adzuna,Support Worker,Voyage Care,"Patcham, Brighton",GB,12.0,12.0,GBP,,0,,"Days/Nights Support Worker Patcham - £12.92 ph-Driver Preferred Typical Shifts are: Day shift and Waking Nights 7:30-10 ,15:00 22:00, 22:30 07:30 Shifts vary based on rota Join Voyage Care and Feel Va...",2025-06-30,https://www.adzuna.co.uk/jobs/details/5275725277?utm_medium=api&utm_source=44534cc0,2025-06-30T15:42:51.091970
5275725219,adzuna,Psychologist,Elysium Healthcare,"Cwmnant, Aberbeeg",GB,0.0,43742.0,GBP,,0,,"Are you an experienced Psychologist looking to take the next step in your career? If so, join Aberbeeg Hospital in Abertillery, a low and medium secure service for men with mental illness and personal...",2025-06-30,https://www.adzuna.co.uk/jobs/details/5275725219?utm_medium=api&utm_source=44534cc0,2025-06-30T15:42:51.091970
5275725270,adzuna,Content Marketing Manager,Armstrong Lloyd - Marketing Recruitment,"Brighton, East Sussex",GB,40000.0,45000.0,GBP,AI,1,permanent,"Content Marketing Manager Role Overview Hybrid: 3 days office, 2 days remote Salary: up to £45,000 pa open to discuss depending on experience Location: Brighton, a short walk from the station, or disc...",2025-06-30,https://www.adzuna.co.uk/jobs/details/5275725270?utm_medium=api&utm_source=44534cc0,2025-06-30T15:42:51.091970
5275725217,adzuna,Night Chef,Thomas Franks Ltd,"Newbold, Rugby",GB,27035.69,27035.69,GBP,,0,permanent,"Night Chef Rugby Contract: Part Time , Permanent Salary: £14 Hours: 10 per week A fantastic B&I location in Rugby for a leading soft drink company. Catering for 300 at this location. We have a breakfa...",2025-06-30,https://www.adzuna.co.uk/jobs/details/5275725217?utm_medium=api&utm_source=44534cc0,2025-06-30T15:42:51.091970
5275725230,adzuna,Commercial Insurance Broker,Recruit Insure Ltd,"London, UK",GB,50000.0,60000.0,GBP,,0,permanent,"Job Title: Commercial Insurance Broker / Account Executive Location: City of London (Fenchurch Street office - hybrid flexibility) Salary: £50,000 - £60,000 basic  performance-based bonus Recruit Ins ...",2025-06-30,https://www.adzuna.co.uk/jobs/details/5275725230?utm_medium=api&utm_source=44534cc0,2025-06-30T15:42:51.091970
5275725250,adzuna,Lead Psychologist (Copy),Elysium Healthcare,"Cuerdley, Warrington",GB,70000.0,75000.0,GBP,,0,,"Are you an experienced Senior Psychologist looking for a new challenge in a rewarding environment, where you can make a real difference? If so, then join the team at Gateway Recovery Centre in Widnes,...",2025-06-30,https://www.adzuna.co.uk/jobs/details/5275725250?utm_medium=api&utm_source=44534cc0,2025-06-30T15:42:51.091970
5275725224,adzuna,Stores Person,2 Sisters Food Group,"Tiverton Junction, Cullompton",GB,12.0,,GBP,AI,1,permanent,"Come and join us! We currently have exciting, permanent opportunities for a Stores Person to join our team in Willand, Devon. This post is working days - Monday to Friday There are two shift patterns ...",2025-06-30,https://www.adzuna.co.uk/jobs/details/5275725224?utm_medium=api&utm_source=44534cc0,2025-06-30T15:42:51.091970
5275725290,adzuna,Waiting Staff - Part Time,Prezzo,"Rayleigh, Essex",GB,0.0,25396.0,GBP,AI,1,,"Waiting Staff - Part Time ""Better Careers for Everyone!"" up to £12.21 per hour, plus tronc (shared tips on site) and access to our amazing commission schem e! As a Front of House Waiting Team Member a...",2025-06-30,https://www.adzuna.co.uk/jobs/details/5275725290?utm_medium=api&utm_source=44534cc0,2025-06-30T15:42:51.092968
5275725275,adzuna,Executive Chef Manager,Thomas Franks Ltd,"Brownhill, Ruyton Xi Towns",GB,42000.0,42000.0,GBP,AI,1,permanent,"Executive Chef Manager Ruyton-XI-Towns Contract: Full Time , Permanent Salary: £ 42,000 per annum Hours: 40 per week A co-educational private prep school for pupils from the ages of 4 to 13, offering ...",2025-06-30,https://www.adzuna.co.uk/jobs/details/5275725275?utm_medium=api&utm_source=44534cc0,2025-06-30T15:42:51.092968
5275725286,adzuna,Care Assistant - Bank,Akari Care,"Fairfield, Stockton-On-Tees",GB,26416.0,26416.0,GBP,AI,1,,"Package Description: About the role and Akari Care Akari Care is a trusted provider of personalised nursing and residential care within local communities across England and Wales. As a Care Assistant,...",2025-06-30,https://www.adzuna.co.uk/jobs/details/5275725286?utm_medium=api&utm_source=44534cc0,2025-06-30T15:42:51.092968
5275725294,adzuna,Developer Services Supervisor,The Clancy Group,"Lenham, Maidstone",GB,34000.0,38000.0,GBP,AI,1,,"Developer Services Supervisor £34,000-£38,000 Lenham We are Ambitious That’s why we need determined & motivated people like you, to help us to deliver critical work on behalf of our customers. We have...",2025-06-30,https://www.adzuna.co.uk/jobs/details/5275725294?utm_medium=api&utm_source=44534cc0,2025-06-30T15:42:51.092968
5275725248,adzuna,Housekeeping Assistant - Bank,Avery Healthcare,"Peasmarsh, Guildford",GB,26000.0,26000.0,GBP,,0,,"Package Description: At Avery Healthcare, we are all about supporting the people who care for our residents. We know how hard our teams work, and we’re here to celebrate and support you every step of ...",2025-06-30,https://www.adzuna.co.uk/jobs/details/5275725248?utm_medium=api&utm_source=44534cc0,2025-06-30T15:42:51.092968
5275725265,adzuna,Support Worker,Voyage Care,"Cherry Hinton, Cambridge",GB,12.0,12.0,GBP,AI,1,,"Support Worker Town Cambridge CB1 £12.55ph Typical Shifts are : Every 7.30am-2.30pm and 2.30pm-9.30pm UK Manual DL Required Join Voyage Care and Feel Valued, we reward your dedication with: Enhanced e...",2025-06-30,https://www.adzuna.co.uk/jobs/details/5275725265?utm_medium=api&utm_source=44534cc0,2025-06-30T15:42:51.092968
5275725233,adzuna,Assistant Manager,Brunning & Price,"Wrinehill, Crewe",GB,0.0,32000.0,GBP,AI,1,,"If you insist on delivering top-notch service and thrive in a vibrant atmosphere, we’d love you to indulge your passion for exceptional food and drink as our Assistant Manager . We’re looking for some...",2025-06-30,https://www.adzuna.co.uk/jobs/details/5275725233?utm_medium=api&utm_source=44534cc0,2025-06-30T15:42:51.092968
5275725281,adzuna,Production Machine Line Operator,Crooton,"Sawtry, Huntingdon",GB,27456.0,32032.0,GBP,AI,1,permanent,"Machine Operative, Days – Production Location: Peterborough, Cambridgeshire Salary: £13.20 – £15.40 per hour (DOE) Hours: 42 hours per week | 4 on, 4 off – Day Shifts (5.45 am - 6.15 pm) Job Type: Ful...",2025-06-30,https://www.adzuna.co.uk/jobs/details/5275725281?utm_medium=api&utm_source=44534cc0,2025-06-30T15:42:51.092968
5275725235,adzuna,Sous Chef,The Knaresborough Inn,"Scriven, Knaresborough",GB,0.0,33000.0,GBP,Go,1,,"What makes the perfect pub? It’s great ales, delicious food, a welcoming atmosphere, and the warm welcome from a team that’s at the heart of everything we do. The Inn Collection Group is a multi-award...",2025-06-30,https://www.adzuna.co.uk/jobs/details/5275725235?utm_medium=api&utm_source=44534cc0,2025-06-30T15:42:51.092968
5275724331,adzuna,Senior Full Stack Developer,Spectrum IT Recruitment,"Oxford, Oxfordshire",GB,65000.0,70000.0,GBP,,0,permanent,"Senior Full Stack Developer - Fully Remote | SaaS Web Analytics Here's your chance to play a pivotal role in a high-growth, award-winning SaaS company delivering cutting-edge web analytics tools to a ...",2025-06-30,https://www.adzuna.co.uk/jobs/land/ad/5275724331?se=5PSvIbhV8BGybp_6wFacNg&utm_medium=api&utm_source=44534cc0&v=FD836E8A85A4C9ABFABF3E298A2F75518F9E2045,2025-06-30T15:42:59.069683
5275723414,adzuna,Software Engineer - Java Microservices,Sanderson,"London, UK",GB,80000.0,115000.0,GBP,Java,1,permanent,"Role: Software Engineer Location: 1-2 days a week in London Salary: £80,000 - £115,000  Bonus Are you a motivated java micro-services specialised software engineer looking to elevate your career? This...",2025-06-30,https://www.adzuna.co.uk/jobs/land/ad/5275723414?se=5PSvIbhV8BGybp_6wFacNg&utm_medium=api&utm_source=44534cc0&v=A5A17AE3B8E470C52B1E8CE608F50E1852DF1E47,2025-06-30T15:42:59.069683
5275722630,adzuna,Integration Engineer - Hybrid - Outside IR35,Lorien,"London, UK",GB,78023.6,78023.6,GBP,Azure,1,contract,"Integration Engineer - Hybrid Working - Outside IR35 Our client, a global Insurance broker, are currently looking to hire an Azure Integration Engineer with strong Microsoft Azure experience and a bac...",2025-06-30,https://www.adzuna.co.uk/jobs/land/ad/5275722630?se=5PSvIbhV8BGybp_6wFacNg&utm_medium=api&utm_source=44534cc0&v=795C4080048D377813B9E23F70AED7C22FD4B0EA,2025-06-30T15:42:59.069683
5275721918,adzuna,Cable/Harness Design Engineer,Meritus Talent,"Stevenage, Hertfordshire",GB,114400.0,124800.0,GBP,Go,1,contract,MERITUS Talent are working with one of Europe's leading aerospace and defence manufacturers for the recruitment of a Cable/Harness Design Engineer to join their Stevenage office on an initial 6 month ...,2025-06-30,https://www.adzuna.co.uk/jobs/land/ad/5275721918?se=5PSvIbhV8BGybp_6wFacNg&utm_medium=api&utm_source=44534cc0&v=BBE670FC95B6221266B77E958B8FAD32FF27C287,2025-06-30T15:42:59.069683
5275719138,adzuna,Senior Test Engineer,Civica,"London, UK",GB,47662.73,47662.73,GBP,Go,1,,"About Civica We're Civica and we make software that helps deliver critical services for citizens all around the world. From local to state government, to education, to health and care, over 5,000 publ...",2025-06-30,https://www.adzuna.co.uk/jobs/details/5275719138?utm_medium=api&utm_source=44534cc0,2025-06-30T15:42:59.069683
5275714951,adzuna,Senior Civil Engineer,MOTT MACDONALD-4,"Belfast, Northern Ireland",GB,46395.02,46395.02,GBP,,0,contract,"Location/s: Belfast, UK Recruiter contact: Alice Roostan Mott MacDonald is a global engineering, management, and development consultancy with over 20,000 employees across more than 50 countries and 14...",2025-06-30,https://www.adzuna.co.uk/jobs/land/ad/5275714951?se=5PSvIbhV8BGybp_6wFacNg&utm_medium=api&utm_source=44534cc0&v=B2B177D8558893D558E1A8ECF693E914777DDAB6,2025-06-30T15:42:59.069683
5275714924,adzuna,Angular-Java Full Stack Software Engineer III,J.P. MORGAN-1,"Glasgow, Scotland",GB,63657.94,63657.94,GBP,"Java, Angular, Agile",3,,Job Description We have an exciting and rewarding opportunity for you to take your software engineering career to the next level. As a Software Engineer III at JPMorgan Chase within the Corporate Data...,2025-06-30,https://www.adzuna.co.uk/jobs/land/ad/5275714924?se=5PSvIbhV8BGybp_6wFacNg&utm_medium=api&utm_source=44534cc0&v=D53D0F779A0F2C80AD1F2998D1AB0D6DE4538F68,2025-06-30T15:42:59.069683
5275714872,adzuna,"Lead UI Software Engineer - Stack: React, Typescript, Java, Spring",J.P. MORGAN-1,"London, UK",GB,71352.82,71352.82,GBP,"Java, React, Agile",3,,"Job Description As a Lead Software Engineer at JPMorgan Chase within the Corporate and Investment Banking Payments Technology, you play a crucial role in an agile team that is dedicated to improving, ...",2025-06-30,https://www.adzuna.co.uk/jobs/land/ad/5275714872?se=5PSvIbhV8BGybp_6wFacNg&utm_medium=api&utm_source=44534cc0&v=62C452BEDD25988257AE59F9171524F3A251FC55,2025-06-30T15:42:59.069683
5275714870,adzuna,Lead Software Engineer - Design Engineering (Design System),J.P. MORGAN-1,"London, UK",GB,53767.76,53767.76,GBP,,0,,"Job Description Join JPMorganChase's business accelerator team, a hub of innovation and customer-centric product development. We're a new B2B organisation, part of a venture focused on creating engagi...",2025-06-30,https://www.adzuna.co.uk/jobs/land/ad/5275714870?se=5PSvIbhV8BGybp_6wFacNg&utm_medium=api&utm_source=44534cc0&v=7B7DC0336DB68891FB04D2F0165E2FA284DE9F17,2025-06-30T15:42:59.069683
5275714867,adzuna,Software Engineer III - Back-end Engineer - Chase UK,J.P. MORGAN-1,"London, UK",GB,56531.03,56531.03,GBP,,0,,"Job Description At JP Morgan Chase, we understand that customers seek exceptional value and a seamless experience from a trusted financial institution. That's why we launched Chase UK to transform dig...",2025-06-30,https://www.adzuna.co.uk/jobs/land/ad/5275714867?se=5PSvIbhV8BGybp_6wFacNg&utm_medium=api&utm_source=44534cc0&v=A3723F87F969C680D5892D18BC2F5C1FADA109C6,2025-06-30T15:42:59.069683
5275714873,adzuna,Senior Lead eSoftware Engineer - Equities Algo Trading - Java - VP,J.P. MORGAN-1,"London, UK",GB,80140.94,80140.94,GBP,"Java, Go, Agile",3,,Job Description We have an opportunity to impact your career and provide an adventure where you can push the limits of what's possible. As a Senior Lead Software Engineer at JPMorgan Chase within the ...,2025-06-30,https://www.adzuna.co.uk/jobs/land/ad/5275714873?se=5PSvIbhV8BGybp_6wFacNg&utm_medium=api&utm_source=44534cc0&v=49F8DF0ABC938E8A37C9914E4E555792281584A4,2025-06-30T15:42:59.069683
5275714854,adzuna,Python & UI Lead Software Engineer,J.P. MORGAN-1,"Glasgow, Scotland",GB,62564.78,62564.78,GBP,"Python, Agile",2,,Job Description We have an opportunity to impact your career and provide an adventure where you can push the limits of what's possible. As a Lead Software Engineer at JPMorgan Chase within the Firm wi...,2025-06-30,https://www.adzuna.co.uk/jobs/land/ad/5275714854?se=5PSvIbhV8BGybp_6wFacNg&utm_medium=api&utm_source=44534cc0&v=C4F5438634E759BE227914778F2F6823FCD32781,2025-06-30T15:42:59.069683
5275714795,adzuna,Applied AI ML Lead - Senior Machine Learning Engineer - Commercial and Investment Bank,J.P. MORGAN-1,"London, UK",GB,69504.72,69504.72,GBP,"Machine Learning, AI",2,,"Job Description Take a technical leadership position within JPMorgan's Commercial & Investment Bank, where you'll harness cutting-edge AI techniques to revolutionize business decisions and automate pr...",2025-06-30,https://www.adzuna.co.uk/jobs/land/ad/5275714795?se=5PSvIbhV8BGybp_6wFacNg&utm_medium=api&utm_source=44534cc0&v=2FA1027904D7F9BF764068C3BE6C495DCA50D225,2025-06-30T15:42:59.069683
5275714748,adzuna,Software Engineer II - UX,J.P. MORGAN-1,"Dorset, South West England",GB,44957.73,44957.73,GBP,"AI, Agile",2,,Job Description You're ready to gain the skills and experience needed to grow within your role and advance your career — and we have the perfect software engineering opportunity for you. As a Software...,2025-06-30,https://www.adzuna.co.uk/jobs/land/ad/5275714748?se=5PSvIbhV8BGybp_6wFacNg&utm_medium=api&utm_source=44534cc0&v=15E8B4A2A0A43E01A0ED8A0FD09B7EC3B512FF52,2025-06-30T15:42:59.069683
5275714745,adzuna,C++ & Java Software Engineer III - Athena Data Frameworks,J.P. MORGAN-1,"London, UK",GB,51733.16,51733.16,GBP,"Java, C++, Agile",3,,Job Description We have an exciting and rewarding opportunity for you to take your software engineering career to the next level. As a Software Engineer III at JPMorgan Chase within the Athena Platfor...,2025-06-30,https://www.adzuna.co.uk/jobs/land/ad/5275714745?se=5PSvIbhV8BGybp_6wFacNg&utm_medium=api&utm_source=44534cc0&v=8D8C3EBD6443E59FE277749433FB736ACC0AD8BA,2025-06-30T15:42:59.069683
5275714751,adzuna,"Software Engineer III - React, Senior Associate",J.P. MORGAN-1,"London, UK",GB,69712.16,69712.16,GBP,"React, Agile",2,,Job Description We have an exciting and rewarding opportunity for you to take your software engineering career to the next level. As a React Software Engineer III at JPMorgan Chase within Athena Trade...,2025-06-30,https://www.adzuna.co.uk/jobs/land/ad/5275714751?se=5PSvIbhV8BGybp_6wFacNg&utm_medium=api&utm_source=44534cc0&v=8B4F928BF75CF44F5FA8E0D0D26DC87F01E4ECA4,2025-06-30T15:42:59.069683
5275714728,adzuna,Software Engineer II,J.P. MORGAN-1,"London, UK",GB,52286.05,52286.05,GBP,Agile,1,,Job Description We have an opportunity to impact your career and provide an adventure where you can push the limits of what's possible. As a Software Engineer at JPMorgan Chase within the Commercial &...,2025-06-30,https://www.adzuna.co.uk/jobs/land/ad/5275714728?se=5PSvIbhV8BGybp_6wFacNg&utm_medium=api&utm_source=44534cc0&v=C5BF6BD62F2E7889A3BA78F0807A53A097900BF2,2025-06-30T15:42:59.069683
5275714663,adzuna,Software Engineer III - Python,J.P. MORGAN-1,"Dorset, South West England",GB,63341.34,63341.34,GBP,"Python, AI, Agile",3,,Job Description We have an exciting and rewarding opportunity for you to take your software engineering career to the next level. As a Software Engineer III at JPMorgan Chase within the Enterprise Tec...,2025-06-30,https://www.adzuna.co.uk/jobs/land/ad/5275714663?se=5PSvIbhV8BGybp_6wFacNg&utm_medium=api&utm_source=44534cc0&v=C0D35180D42F7FB79EC7A962F14F9673B4D0CD98,2025-06-30T15:42:59.069683
5275714656,adzuna,Senior Lead Software Engineer - Full Stack Developer Java/Kafka,J.P. MORGAN-1,"Glasgow, Scotland",GB,73271.09,73271.09,GBP,"Java, Agile",2,,"Job Description Be an integral part of an agile team that's constantly pushing the envelope to enhance, build, and deliver top-notch technology products. As a Senior Lead Software Engineer at JPMorgan...",2025-06-30,https://www.adzuna.co.uk/jobs/land/ad/5275714656?se=5PSvIbhV8BGybp_6wFacNg&utm_medium=api&utm_source=44534cc0&v=F2EAC96608CD49A3663C68A0FD59B34C8006E2FE,2025-06-30T15:42:59.069683
5275714627,adzuna,Lead Software Engineer - Java - Payments - Chase UK,J.P. MORGAN-1,"London, UK",GB,56279.98,56279.98,GBP,Java,1,,"Job Description We know that people want great value combined with an excellent experience from a bank they can trust, so we launched our digital bank, Chase UK, to revolutionise mobile banking with s...",2025-06-30,https://www.adzuna.co.uk/jobs/land/ad/5275714627?se=5PSvIbhV8BGybp_6wFacNg&utm_medium=api&utm_source=44534cc0&v=2EF24BBF169C8F5C2C9BA747E0E3E8CD18A0994E,2025-06-30T15:42:59.069683
5275714642,adzuna,Lead Software Engineer - Cloud Platform Engineering,J.P. MORGAN-1,"London, UK",GB,73356.95,73356.95,GBP,,0,,"Job Description Out of the successful launch of Chase in 2021, we're a new team, with a new mission. We're creating products that solve real world problems and put customers at the center - all in an ...",2025-06-30,https://www.adzuna.co.uk/jobs/land/ad/5275714642?se=5PSvIbhV8BGybp_6wFacNg&utm_medium=api&utm_source=44534cc0&v=93941A79D94FFFE4AAD93FB110B0E4B56249D2DC,2025-06-30T15:42:59.069683
5275714629,adzuna,Lead Software Engineer - Backend Engineering - Java/Kotlin,J.P. MORGAN-1,"London, UK",GB,57455.11,57455.11,GBP,Java,1,,"Job Description Out of the successful launch of Chase in 2021, we're a new team, with a new mission. We're creating products that solve real world problems and put customers at the center - all in an ...",2025-06-30,https://www.adzuna.co.uk/jobs/land/ad/5275714629?se=5PSvIbhV8BGybp_6wFacNg&utm_medium=api&utm_source=44534cc0&v=1D39496BA468D82C9629E29CCE7D85F7C04177FC,2025-06-30T15:42:59.069683
5275714601,adzuna,Senior Lead Software Engineer,J.P. MORGAN-1,"Glasgow, Scotland",GB,66272.61,66272.61,GBP,Agile,1,,Job Description We have an opportunity to impact your career and provide an adventure where you can push the limits of what's possible. As a Senior Lead Software Engineer within the Treasury & Chief I...,2025-06-30,https://www.adzuna.co.uk/jobs/land/ad/5275714601?se=5PSvIbhV8BGybp_6wFacNg&utm_medium=api&utm_source=44534cc0&v=A7957182D28351B2F527D8FFE5F94CE545DDE866,2025-06-30T15:42:59.069683
5275714578,adzuna,Director of Software Engineering - Credit Real-time Risk,J.P. MORGAN-1,"London, UK",GB,84381.82,84381.82,GBP,,0,,"Job Description As a Director of Software Engineering at JPMorgan Chase within the Commercial and Investment Bank, Credit Technology team - you lead a technical area and drive impact within teams, tec...",2025-06-30,https://www.adzuna.co.uk/jobs/land/ad/5275714578?se=5PSvIbhV8BGybp_6wFacNg&utm_medium=api&utm_source=44534cc0&v=90601C2E4A2785AA01EE78D55612148F5520DFB0,2025-06-30T15:42:59.069683
5275714567,adzuna,Senior Director of Software Engineering - Head of Data Catalog,J.P. MORGAN-1,"Glasgow, Scotland",GB,69819.02,69819.02,GBP,,0,,"Job Description As the Senior Director of Software Engineering - Head of Data Catalog in the Chief Data and Analytics Office (CDAO) Data Platforms team, you will lead the design and engineering of the...",2025-06-30,https://www.adzuna.co.uk/jobs/land/ad/5275714567?se=5PSvIbhV8BGybp_6wFacNg&utm_medium=api&utm_source=44534cc0&v=DDFAAEADBA2022FDCBA384C471634FCD5F1C266C,2025-06-30T15:42:59.069683
5275714590,adzuna,Software Architect,JAGUAR LAND ROVER-2,"Warwickshire, West Midlands",GB,56000.0,70000.0,GBP,,0,,"REQ ID: 128335 JOB TITLE: Software Architect SALARY: £56,000 - £70,000 POSTING START DATE: 19/06/2025 POSTING END DATE: 26/06/2025 LOCATION: Gaydon Product Engineering at JLR is centred on innovation ...",2025-06-30,https://www.adzuna.co.uk/jobs/land/ad/5275714590?se=5PSvIbhV8BGybp_6wFacNg&utm_medium=api&utm_source=44534cc0&v=36B01FAFE91995A15BED0519D332B230F85CF1D9,2025-06-30T15:42:59.069683
